{
  "$schema": "../page.schema.json",
  "slug": "canva",
  "title": "Canva",
  "seo": {
    "description": "Brošura keramičkog studija TRAG izrađena u Canvi."
  },
  "blocks": [
    {
      "type": "hero",
      "eyebrow": "Alat — Canva",
      "heading": "Brošura izrađena u Canvi",
      "lead": "Canvu sam odabrala jer u njoj imam najviše iskustva, pa mi je cijeli proces izrade bio jednostavan i brz. Boje i fontove preuzela sam s web stranice kako bi brošura i web djelovali kao jedna cjelina.",
      "specs": [
        {
          "label": "Format",
          "value": "43,2 × 27,9 cm"
        },
        {
          "label": "Alat",
          "value": "Canva Free",
          "font": "'Work Sans', system-ui, sans-serif",
          "note": "Besplatna verzija, korištena u web pregledniku bez instalacije."
        }
      ]
    },
    {
      "type": "process",
      "variant": "surface",
      "eyebrow": "Postupak",
      "tool": "Fotografije: Unsplash, besplatna licenca",
      "items": [
        {
          "text": "Na početnoj stranici Canve odabrala sam „Create a design“ pa „Custom size“. Mjernu jedinicu prebacila sam s piksela na centimetre i upisala 43,2 × 27,9 cm u vodoravnoj orijentaciji. Otvorio se prazan bijeli radni prostor u toj veličini."
        },
        {
          "text": "Iz lijeve alatne trake otvorila sam karticu „Text“ i dodala naslov TRAG — KERAMIČKA RADIONICA, a ispod njega kratak opis radionice u nekoliko rečenica. Oba teksta poravnala sam uz lijevi rub, u gornjoj polovici lijeve strane. Fontove sam odabrala iste kao na web stranici — Fraunces za naslov i Work Sans za tekst — kako bi brošura i web bili prepoznatljivo isti."
        },
        {
          "text": "Fotografiju ruku na lončarskom kolu preuzela sam s Unsplasha, koji nudi fotografije pod besplatnom licencom. Ubacila sam ju kroz karticu „Uploads“ i opcijom „Upload files“, zatim razvukla preko cijele desne polovice i obrezala tako da zauzima punu visinu brošure."
        },
        {
          "text": "Kliknula sam na praznu podlogu i u biraču boja upisala hex #F7F4EF — istu boju koju koristim i na web stranici, kako bi tiskani i digitalni materijal djelovali kao cjelina."
        },
        {
          "text": "Iz kartice „Elements“ dodala sam pravokutnik u donji lijevi kut i obojala ga accent bojom #B45B38, istom koja se na webu koristi za naglaske, da se istakne na svijetloj podlozi. U njega sam upisala termine radionica, adresu i kontakt broj. Tekst sam postavila u bijelu boju zbog boljeg kontrasta na tamnijoj podlozi."
        },
        {
          "text": "Sredina brošure izgledala je prazno, pa sam dodala još jednu fotografiju keramičkih posuda. Pomicala sam ju i mijenjala veličinu dok nije najbolje sjela — između dva teksta, tako da rubom malo prelazi preko desne fotografije i povezuje dvije polovice."
        },
        {
          "text": "Ispod te fotografije dodala sam bijeli pravokutnik nešto većih dimenzija i preko izbornika „Position“ opcijom „Send backward“ ga poslala iza slike. Tako viri sa svih strana i djeluje kao okvir koji sliku odvaja od pozadine."
        },
        {
          "text": "Za kraj sam iza riječi TRAG u naslovu dodala pravokutnik u accent boji, a slova obojala bijelo."
        },
        {
          "text": "Gotov dizajn izvezla sam preko gumba „Share“ pa „Download“, odabravši format PNG. Datoteku sam zatim spremila u projekt i uključila na ovu stranicu."
        }
      ]
    },
    {
      "type": "figure",
      "eyebrow": "Izrada",
      "heading": "Brošura u Canvi",
      "src": "/img/canva.png",
      "alt": "Sučelje Canve s otvorenim dizajnom brošure: radna površina s rasporedom teksta i fotografija, uz lijevu alatnu traku i gornju traku s postavkama.",
      "caption": "Radna površina prije izvoza, s poravnanjem elemenata po mreži.",
      "width": 3018,
      "height": 1502
    },
    {
      "type": "figure",
      "eyebrow": "Rezultat",
      "heading": "Gotova brošura",
      "src": "/img/brosura.png",
      "alt": "Vodoravna brošura keramičke radionice TRAG: lijevo naslov s nazivom studija na terakota podlozi i opis radionice, ispod fotografija zelenih keramičkih vaza u bijelom okviru te terakota blok s terminima radionica, adresom i kontakt brojem; desno fotografija ruku koje oblikuju posudu na lončarskom kolu.",
      "caption": "Brošura u formatu 43,2 × 27,9 cm, izvezena kao PNG iz Canve.",
      "width": 2000,
      "height": 1294,
      "download": {
        "href": "/img/brosura.png",
        "label": "Preuzmi brošuru (PNG)"
      },
      "tight": true
    }
  ]
}
